{
    "triplets": [
        {
            "Subject": "Gh0st RAT",
            "SubjectType": "Malware",
            "Relation": "used to",
            "Object": "compromise systems",
            "ObjectType": "infrastrcucture",
            "tactic": "Others",
            "technique": [
                "Others"
            ]
        },
        {
            "Subject": "McAfee Foundstone",
            "SubjectType": "CTI vender",
            "Relation": "discovered",
            "Object": "Gh0st RAT variant",
            "ObjectType": "Malware",
            "tactic": "Others",
            "technique": [
                "Others"
            ]
        },
        {
            "Subject": "McAfee researchers",
            "SubjectType": "CTI vender",
            "Relation": "discovered",
            "Object": "Gh0st RAT variant",
            "ObjectType": "Malware",
            "tactic": "Others",
            "technique": [
                "Others"
            ]
        },
        {
            "Subject": "Gh0st RAT",
            "SubjectType": "Malware",
            "Relation": "provides",
            "Object": "remote control access",
            "ObjectType": "capability",
            "tactic": "Others",
            "technique": [
                "Others"
            ]
        },
        {
            "Subject": "Gh0st RAT",
            "SubjectType": "Malware",
            "Relation": "operates by",
            "Object": "establishing server",
            "ObjectType": "technique",
            "tactic": "Others",
            "technique": [
                "Others"
            ]
        },
        {
            "Subject": "Gh0st RAT",
            "SubjectType": "Malware",
            "Relation": "communicates with",
            "Object": "client component",
            "ObjectType": "tool",
            "tactic": "Others",
            "technique": [
                "Others"
            ]
        },
        {
            "Subject": "Gh0st RAT",
            "SubjectType": "Malware",
            "Relation": "uses",
            "Object": "encryption",
            "ObjectType": "technique",
            "tactic": "Others",
            "technique": [
                "Others"
            ]
        },
        {
            "Subject": "Gh0st RAT",
            "SubjectType": "Malware",
            "Relation": "uses",
            "Object": "network communication methods",
            "ObjectType": "technique",
            "tactic": "Others",
            "technique": [
                "Others"
            ]
        }
    ],
    "file_name": "Know Your Digital Enemy",
    "tactic_label": true,
    "rewrite": {
        "Reconnaissance": "None",
        "Resource Development": "None",
        "Initial Access": "None",
        "Execution": "None",
        "Persistence": "None",
        "Privilege Escalation": "None",
        "Defense Evasion": "None",
        "Credential Access": "None",
        "Discovery": "None",
        "Lateral Movement": "None",
        "Collection": "None",
        "Command and Control": "None",
        "Exfiltration": "None",
        "Impact": "None",
        "Others": "The Gh0st RAT (Remote Access Terminal) was identified as the tool used to compromise systems owned by the Private Office of the Dalai Lama, the Tibetan Government-in-Exile, and other Tibetan entities. McAfee Foundstone and McAfee researchers discovered a similar Gh0st RAT variant targeting corporations in the oil and gas industry, detailed in the Night Dragon investigation. The Gh0st RAT is a sophisticated piece of malware that provides complete remote control access to a compromised host, with the ability to manage thousands of compromised hosts via its command and control (C2) component. The malware's capabilities include existing rootkit removal, file management, screen control, process exploration, keystroke logging, remote terminal access, webcam and voice monitoring, dial-up profile cracking, and more. The Gh0st RAT operates by establishing a server on the compromised host, which then communicates with a client component for further instructions. The malware's source code, dating back to 2001, was analyzed, revealing its extensive capabilities, structure, and operation. The Gh0st RAT uses encryption and network communication methods to avoid detection and can be difficult to defend against. However, fundamental security practices such as monitoring network traffic, performing internal port scans, monitoring DNS servers, services, and event logs, as well as increasing end-user security awareness, can help in identifying and defending against such threats."
    },
    "technique_label": true
}